호텔 이름,평점,평가 수,비용
호텔 그레이서리 오사카 난바,8.7,"7,078명 평가","203,724"
하튼 호텔 신사이바시 나가호리도리,8.9,"12,367명 평가","132,679"
호텔 한큐 리스파이어 오사카,9.0,"39,323명 평가","231,798"
프리미어 호텔 캐빈 프레지던트 오사카,9.0,"7,675명 평가","289,097"
호텔 플라자 오사카,8.1,"3,399명 평가","178,790"
오사카 히노데 호텔 닛폰바시 - 심층수 온천,8.9,"3,240명 평가","217,490"
호텔 비스타 오사카 난바,8.9,"6,022명 평가","291,894"
호텔 몬토레 그라스미아 오사카,8.6,"16,019명 평가","305,978"
호텔 오리엔탈 익스프레스 오사카 신사이바시,8.9,"5,536명 평가","187,312"
난바 오리엔탈 호텔,8.6,"16,195명 평가","317,519"
그리드스 프리미엄 호텔 오사카 남바,8.8,"7,197명 평가","161,946"
호텔 비나리오 우메다,8.0,"5,415명 평가","158,044"
베셀 인 남바,8.6,"1,813명 평가","205,744"
베셀 인 신사이바시,8.9,"6,031명 평가","165,849"
퀸테사 호텔 오사카 신사이바시 코믹 & 북스,8.4,"7,220명 평가","166,825"
도톤보리 호텔,8.9,"3,437명 평가","203,897"
센타라 그랜드 호텔 오사카,9.1,"5,095명 평가","530,670"
칸데오 호텔 오사카 난바,8.7,"23,106명 평가","236,690"
오리엔탈 호텔 유니버설 시티,8.1,"1,811명 평가","389,192"
호텔 그란비아 오사카,8.6,"17,806명 평가","285,358"
IP 시티 호텔 오사카,8.0,"5,343명 평가","105,363"
에스리드 호텔 난바 다이코쿠초,9.0,"1,826명 평가","176,790"
더 브리지 호텔 신사이바시,9.0,"5,673명 평가","233,489"
소테츠 그랜드 프레사 오사카 난바,8.7,"24,033명 평가","143,261"
수퍼 호텔 난바 닛폰바시,8.9,"1,575명 평가","170,593"
호텔 한신 오사카,8.5,"4,250명 평가","222,550"
이마노 오사카 신사이바시 호스텔,8.7,"1,448명 평가","177,410"
호텔 포르자 오사카 난바 도톤보리,9.1,"12,084명 평가","228,422"
로지 호텔 난바,7.3,"1,100명 평가","108,371"
호텔 간사이,7.0,"6,178명 평가","78,761"
오사카 후지야 호텔,8.2,"6,120명 평가","118,378"
호텔 케이한 난바 그란데,8.9,"8,143명 평가","156,355"
소테츠 프레사 인 기타하마,8.8,"4,908명 평가","139,453"
하톤 호텔 신사이바시,8.5,"12,278명 평가","158,000"
미츠이 가든 호텔 오사카 프리미어,8.6,"5,278명 평가","308,934"
타니마치군 호텔 WE 난바28,9.0,246명 평가,"246,040"
호텔 신포인 오사카,8.5,641명 평가,"132,024"
온야도 노노 난바 내추럴 핫 스프링,9.0,"18,069명 평가","288,657"
